{
  "$schema": "http://json-schema.org/draft-07/schema#",
  "$id": "xlog_bundle.v1.schema.json",
  "title": "xlog_bundle.v1",
  "type": "object",
  "additionalProperties": false,
  "required": ["api_version", "generated_at", "source", "parser_config", "summary", "cases", "failure_clusters", "debug_recommendation", "unclustered_failure_case_ids"],
  "definitions": {
    "time_info": {
      "type": "object",
      "additionalProperties": false,
      "required": ["value", "unit", "normalized_fs", "source"],
      "properties": {
        "value": {"type": ["string", "null"]},
        "unit": {"type": ["string", "null"], "enum": ["fs", "ps", "ns", "us", "ms", "s", null]},
        "normalized_fs": {"type": ["string", "null"]},
        "source": {"type": "string", "enum": ["explicit_end_marker", "max_observed_timestamp", "reported_timestamp", "unavailable"]}
      }
    },
    "source_location": {
      "type": "object",
      "additionalProperties": false,
      "required": ["path", "line", "display"],
      "properties": {
        "path": {"type": ["string", "null"]},
        "line": {"type": ["integer", "null"], "minimum": 1},
        "display": {"type": ["string", "null"]}
      }
    },
    "scope_hint": {
      "type": "object",
      "additionalProperties": false,
      "required": ["candidate", "status", "producer", "basis", "final_routing"],
      "properties": {
        "candidate": {"type": "string", "enum": ["shared_public", "environment_private", "unknown"]},
        "status": {"const": "non_authoritative"},
        "producer": {"type": "string", "enum": ["uvm", "vcs", "xcelium", "sva", "configured", "unknown"]},
        "basis": {"type": "array", "items": {"type": "string"}, "minItems": 1},
        "final_routing": {"const": "undetermined"}
      }
    },
    "portable_signature": {
      "type": "object",
      "additionalProperties": false,
      "required": ["strategy", "description_template", "fingerprint"],
      "properties": {
        "strategy": {"const": "level_error_id_producer_description.v1"},
        "description_template": {"type": "string"},
        "fingerprint": {"type": "string", "pattern": "^sha256:[0-9a-f]{64}$"}
      }
    },
    "diagnostic_hint": {
      "type": "object",
      "additionalProperties": false,
      "required": ["code", "line_number", "text"],
      "properties": {
        "code": {"type": "string", "enum": ["JVP_TEST_PASSED", "JVP_TEST_FAILED", "SIMULATION_FINISH", "VCS_SIMULATION_REPORT", "SIM_END_WATCHDOG", "BUS_INACTIVITY", "QP_NOT_COMPLETE", "LOG_READ_FAILED"]},
        "line_number": {"type": ["integer", "null"], "minimum": 1},
        "text": {"type": "string", "maxLength": 240}
      }
    },
    "error": {
      "type": "object",
      "additionalProperties": true,
      "properties": {
        "level": {"type": "string"},
        "error_id": {"type": "string"},
        "report_id": {"type": ["string", "null"]},
        "producer": {"type": "string", "enum": ["uvm", "vcs", "xcelium", "sva", "configured", "unknown"]},
        "error_type": {"type": "string", "enum": ["UVM_WARNING", "UVM_ERROR", "UVM_FATAL", "SV_ASSERTION", "COMPILE_ERROR", "ELABORATION_ERROR", "SIM_RUNTIME_ERROR", "LICENSE_ERROR", "ENVIRONMENT_ERROR", "TOOL_ERROR", "UNKNOWN"]},
        "location": {"type": "string"},
        "source_location": {"$ref": "#/definitions/source_location"},
        "timestamp": {"type": "string"},
        "event_time": {"$ref": "#/definitions/time_info"},
        "description": {"type": "string"},
        "description_template": {"type": "string"},
        "description_template_status": {"type": "string", "enum": ["present", "unavailable"]},
        "scope_hint": {"$ref": "#/definitions/scope_hint"},
        "portable_signature": {"$ref": "#/definitions/portable_signature"}
      }
    },
    "artifact_candidate": {
      "type": "object",
      "additionalProperties": false,
      "required": ["path", "source", "priority", "expected_kind", "exists", "readable", "file_type", "size_bytes", "state", "reason"],
      "properties": {
        "path": {"type": "string"},
        "source": {"type": "string"},
        "priority": {"type": "integer", "minimum": 0},
        "expected_kind": {"type": "string", "enum": ["file", "directory"]},
        "exists": {"type": "boolean"},
        "readable": {"type": "boolean"},
        "file_type": {"type": "string", "enum": ["file", "directory", "other", "missing"]},
        "size_bytes": {"type": ["integer", "null"], "minimum": 0},
        "state": {"type": "string", "enum": ["available", "missing", "unreadable", "wrong_type"]},
        "reason": {"type": ["string", "null"]}
      }
    },
    "artifact_resource": {
      "type": "object",
      "additionalProperties": false,
      "required": ["status", "selected", "candidates", "reason"],
      "properties": {
        "status": {"type": "string", "enum": ["resolved", "ambiguous", "unavailable"]},
        "selected": {"anyOf": [{"$ref": "#/definitions/artifact_candidate"}, {"type": "null"}]},
        "candidates": {"type": "array", "items": {"$ref": "#/definitions/artifact_candidate"}},
        "reason": {"type": ["string", "null"]}
      }
    },
    "manifest_descriptor": {
      "type": "object",
      "additionalProperties": false,
      "required": ["artifact_kind", "expected_schema_version", "schema_version", "path", "resolution_status", "parse_status", "document_state", "reason", "candidates"],
      "properties": {
        "artifact_kind": {"type": "string", "enum": ["xdebug.run_manifest", "xvp.case_manifest"]},
        "expected_schema_version": {"type": "string", "minLength": 1},
        "schema_version": {"type": ["string", "null"]},
        "path": {"type": ["string", "null"]},
        "resolution_status": {"type": "string", "enum": ["resolved", "ambiguous", "unavailable"]},
        "parse_status": {"type": "string", "enum": ["parsed", "not_parsed", "read_error", "invalid_json", "invalid_root", "schema_mismatch", "invalid_state"]},
        "document_state": {"type": ["string", "null"]},
        "reason": {"type": ["string", "null"]},
        "candidates": {"type": "array", "items": {"$ref": "#/definitions/artifact_candidate"}}
      }
    },
    "manifest_snapshot": {
      "type": "object",
      "additionalProperties": false,
      "required": ["preferred_kind", "selection_status", "selected", "items"],
      "properties": {
        "preferred_kind": {"const": "xdebug.run_manifest"},
        "selection_status": {"type": "string", "enum": ["preferred", "legacy_fallback", "unavailable"]},
        "selected": {"anyOf": [{"$ref": "#/definitions/manifest_descriptor"}, {"type": "null"}]},
        "items": {"type": "array", "items": {"$ref": "#/definitions/manifest_descriptor"}, "minItems": 2}
      }
    },
    "artifacts": {
      "type": "object",
      "additionalProperties": false,
      "required": ["status", "case_directory", "resources", "xdebug_target"],
      "properties": {
        "status": {"type": "string", "enum": ["complete", "partial", "ambiguous", "unavailable"]},
        "case_directory": {"type": "string"},
        "resources": {
          "type": "object",
          "additionalProperties": false,
          "required": ["log", "fsdb", "daidir", "kdb", "run_manifest"],
          "properties": {
            "log": {"$ref": "#/definitions/artifact_resource"},
            "fsdb": {"$ref": "#/definitions/artifact_resource"},
            "daidir": {"$ref": "#/definitions/artifact_resource"},
            "kdb": {"$ref": "#/definitions/artifact_resource"},
            "run_manifest": {"$ref": "#/definitions/artifact_resource"}
          }
        },
        "manifests": {"$ref": "#/definitions/manifest_snapshot"},
        "xdebug_target": {
          "type": "object",
          "additionalProperties": false,
          "properties": {
            "fsdb": {"type": "string", "minLength": 1},
            "daidir": {"type": "string", "minLength": 1},
            "run_manifest": {"type": "string", "minLength": 1}
          }
        }
      }
    },
    "case": {
      "type": "object",
      "additionalProperties": true,
      "properties": {
        "case_id": {"type": "string"},
        "relative_log_path": {"type": "string"},
        "log_path": {"type": "string"},
        "working_directory": {"type": "string"},
        "status": {"type": "string", "enum": ["pass", "fail", "error"]},
        "result_state": {"type": "string", "enum": ["PASS", "FAIL_WITH_ERROR", "INCOMPLETE_NO_ERROR", "PARSE_ERROR"]},
        "diagnostic_hints": {"type": "array", "maxItems": 8, "items": {"$ref": "#/definitions/diagnostic_hint"}},
        "test_id": {"type": "string"},
        "seed": {"type": ["integer", "null"]},
        "seed_parse_status": {"type": "string", "enum": ["parsed", "fallback"]},
        "simulation_time": {"$ref": "#/definitions/time_info"},
        "primary_error": {"anyOf": [{"$ref": "#/definitions/error"}, {"type": "null"}]},
        "top_errors": {"type": "array", "items": {"$ref": "#/definitions/error"}},
        "artifacts": {"$ref": "#/definitions/artifacts"}
      }
    },
    "case_reference": {
      "type": "object",
      "additionalProperties": false,
      "required": ["case_id", "test_id", "seed", "seed_parse_status", "simulation_time", "artifacts"],
      "properties": {
        "case_id": {"type": "string"},
        "test_id": {"type": "string"},
        "seed": {"type": ["integer", "null"]},
        "seed_parse_status": {"type": "string", "enum": ["parsed", "fallback"]},
        "simulation_time": {"$ref": "#/definitions/time_info"},
        "artifacts": {"$ref": "#/definitions/artifacts"}
      }
    },
    "cluster_signature": {
      "type": "object",
      "additionalProperties": false,
      "required": ["strategy", "level", "error_id", "location", "source_location", "description_template", "scope_hint", "portable_signature", "fingerprint"],
      "properties": {
        "strategy": {"type": "string", "enum": ["level_error_id_location_description", "level_error_id_producer_portable_description"]},
        "level": {"type": "string"},
        "error_id": {"type": "string"},
        "location": {"type": "string"},
        "source_location": {"$ref": "#/definitions/source_location"},
        "description_template": {"type": "string"},
        "scope_hint": {"$ref": "#/definitions/scope_hint"},
        "portable_signature": {"$ref": "#/definitions/portable_signature"},
        "fingerprint": {"type": "string", "pattern": "^sha256:[0-9a-f]{64}$"}
      }
    },
    "cluster_recommendation": {
      "type": "object",
      "additionalProperties": true,
      "required": ["rank", "selected", "recommended_case_id", "recommended_case", "alternate_case_ids", "alternate_cases", "recommended_artifacts", "score_components", "reasons"],
      "properties": {
        "rank": {"type": "integer", "minimum": 1},
        "selected": {"type": "boolean"},
        "recommended_case_id": {"type": ["string", "null"]},
        "recommended_case": {"anyOf": [{"$ref": "#/definitions/case_reference"}, {"type": "null"}]},
        "alternate_case_ids": {"type": "array", "items": {"type": "string"}},
        "alternate_cases": {"type": "array", "items": {"$ref": "#/definitions/case_reference"}},
        "recommended_artifacts": {"anyOf": [{"$ref": "#/definitions/artifacts"}, {"type": "null"}]},
        "score_components": {"type": "object"},
        "reasons": {"type": "array", "items": {"type": "string"}}
      }
    },
    "failure_cluster": {
      "type": "object",
      "additionalProperties": true,
      "properties": {
        "cluster_id": {"type": "string"},
        "fingerprint": {"type": "string", "pattern": "^sha256:[0-9a-f]{64}$"},
        "signature": {"$ref": "#/definitions/cluster_signature"},
        "representative_case_id": {"type": "string"},
        "representative_error": {"$ref": "#/definitions/error"},
        "case_ids": {"type": "array", "items": {"type": "string"}},
        "recommendation": {"$ref": "#/definitions/cluster_recommendation"}
      }
    },
    "diagnostic_candidate": {
      "type": "object",
      "additionalProperties": false,
      "required": ["case_id", "result_state", "test_id", "seed", "log_path", "diagnostic_hints"],
      "properties": {
        "case_id": {"type": "string"},
        "result_state": {"type": "string", "enum": ["INCOMPLETE_NO_ERROR", "PARSE_ERROR"]},
        "test_id": {"type": "string"},
        "seed": {"type": ["integer", "null"]},
        "log_path": {"type": "string"},
        "diagnostic_hints": {"type": "array", "maxItems": 8, "items": {"$ref": "#/definitions/diagnostic_hint"}}
      }
    }
  },
  "properties": {
    "api_version": {"const": "xlog_bundle.v1"},
    "schema_revision": {
      "type": "string",
      "pattern": "^1\\.[0-9]+$",
      "default": "1.0",
      "description": "Explicit minor contract revision. Omission is accepted only for legacy revision 1.0 bundles."
    },
    "generated_at": {"type": "string"},
    "source": {"type": "object"},
    "parser_config": {"type": "object"},
    "artifact_config": {"type": "object"},
    "summary": {"type": "object"},
    "cases": {"type": "array", "items": {"$ref": "#/definitions/case"}},
    "failure_clusters": {"type": "array", "items": {"$ref": "#/definitions/failure_cluster"}},
    "diagnostic_candidates": {"type": "array", "items": {"$ref": "#/definitions/diagnostic_candidate"}},
    "debug_recommendation": {
      "type": "object",
      "additionalProperties": true,
      "required": ["policy_version", "debug_budget", "eligible_cluster_count", "selected_cluster_count", "recommended_debug_cases", "deferred_cluster_ids"],
      "properties": {
        "policy_version": {"type": "string"},
        "debug_budget": {"type": "integer", "minimum": 1},
        "eligible_cluster_count": {"type": "integer", "minimum": 0},
        "selected_cluster_count": {"type": "integer", "minimum": 0},
        "recommended_debug_cases": {
          "type": "array",
          "items": {
            "type": "object",
            "additionalProperties": true,
            "required": ["rank", "cluster_id", "case_id", "test_id", "seed", "seed_parse_status", "simulation_time", "artifacts", "alternate_cases", "score_components", "reasons"],
            "properties": {
              "artifacts": {"anyOf": [{"$ref": "#/definitions/artifacts"}, {"type": "null"}]},
              "alternate_cases": {"type": "array", "items": {"$ref": "#/definitions/case_reference"}}
            }
          }
        },
        "deferred_cluster_ids": {"type": "array", "items": {"type": "string"}}
      }
    },
    "unclustered_failure_case_ids": {"type": "array", "items": {"type": "string"}}
  }
}
