{
  "api_version": "xlog_bundle.v1",
  "artifact_config": {
    "daidir_templates": [
      "{log_dir}/simv.daidir",
      "{regression_root}/simv.daidir"
    ],
    "fsdb_templates": [
      "{log_dir}/{log_stem}.fsdb",
      "{log_dir}/sim_{test_id}.fsdb",
      "{log_dir}/sim.fsdb"
    ],
    "kdb_templates": [],
    "log_reference_extraction": true,
    "run_manifest_templates": []
  },
  "cases": [
    {
      "artifacts": {
        "case_directory": "/fixture/rtl_injection_minimal",
        "resources": {
          "daidir": {
            "candidates": [
              {
                "exists": false,
                "expected_kind": "directory",
                "file_type": "missing",
                "path": "/fixture/rtl_injection_minimal/simv.daidir",
                "priority": 10,
                "readable": false,
                "reason": "not_found",
                "size_bytes": null,
                "source": "configured_template",
                "state": "missing"
              }
            ],
            "reason": "no_existing_candidates",
            "selected": null,
            "status": "unavailable"
          },
          "fsdb": {
            "candidates": [
              {
                "exists": true,
                "expected_kind": "file",
                "file_type": "file",
                "path": "/fixture/rtl_injection_minimal/ambiguous_a.fsdb",
                "priority": 0,
                "readable": true,
                "reason": null,
                "size_bytes": 39,
                "source": "log_reference",
                "state": "available"
              },
              {
                "exists": true,
                "expected_kind": "file",
                "file_type": "file",
                "path": "/fixture/rtl_injection_minimal/ambiguous_b.fsdb",
                "priority": 0,
                "readable": true,
                "reason": null,
                "size_bytes": 39,
                "source": "log_reference",
                "state": "available"
              },
              {
                "exists": false,
                "expected_kind": "file",
                "file_type": "missing",
                "path": "/fixture/rtl_injection_minimal/ambiguous_wave_31.fsdb",
                "priority": 10,
                "readable": false,
                "reason": "not_found",
                "size_bytes": null,
                "source": "configured_template",
                "state": "missing"
              },
              {
                "exists": false,
                "expected_kind": "file",
                "file_type": "missing",
                "path": "/fixture/rtl_injection_minimal/sim_ambiguous_wave.fsdb",
                "priority": 11,
                "readable": false,
                "reason": "not_found",
                "size_bytes": null,
                "source": "configured_template",
                "state": "missing"
              },
              {
                "exists": false,
                "expected_kind": "file",
                "file_type": "missing",
                "path": "/fixture/rtl_injection_minimal/sim.fsdb",
                "priority": 12,
                "readable": false,
                "reason": "not_found",
                "size_bytes": null,
                "source": "configured_template",
                "state": "missing"
              }
            ],
            "reason": "multiple_best_candidates",
            "selected": null,
            "status": "ambiguous"
          },
          "kdb": {
            "candidates": [],
            "reason": "no_candidates",
            "selected": null,
            "status": "unavailable"
          },
          "log": {
            "candidates": [
              {
                "exists": true,
                "expected_kind": "file",
                "file_type": "file",
                "path": "/fixture/rtl_injection_minimal/ambiguous_wave_31.log",
                "priority": 0,
                "readable": true,
                "reason": null,
                "size_bytes": 179,
                "source": "discovered_log",
                "state": "available"
              }
            ],
            "reason": null,
            "selected": {
              "exists": true,
              "expected_kind": "file",
              "file_type": "file",
              "path": "/fixture/rtl_injection_minimal/ambiguous_wave_31.log",
              "priority": 0,
              "readable": true,
              "reason": null,
              "size_bytes": 179,
              "source": "discovered_log",
              "state": "available"
            },
            "status": "resolved"
          },
          "run_manifest": {
            "candidates": [],
            "reason": "no_candidates",
            "selected": null,
            "status": "unavailable"
          }
        },
        "status": "ambiguous",
        "xdebug_target": {}
      },
      "case_id": "ambiguous_wave_31.log",
      "log_path": "/fixture/rtl_injection_minimal/ambiguous_wave_31.log",
      "pass_found": false,
      "primary_error": {
        "description": "injected signal did not toggle",
        "description_template": "injected signal did not toggle",
        "description_template_status": "present",
        "error_id": "INJECT_AMBIGUOUS",
        "error_type": "UVM_ERROR",
        "event_time": {
          "normalized_fs": "3000000",
          "source": "reported_timestamp",
          "unit": "ns",
          "value": "3"
        },
        "level": "UVM_ERROR",
        "location": "/project/env/injection_check.sv(300)",
        "portable_signature": {
          "description_template": "injected signal did not toggle",
          "fingerprint": "sha256:c8519960ccd8538f3d2c0ad369a83a868c0486bec11d7755d4fb0ff54fadcefd",
          "strategy": "level_error_id_producer_description.v1"
        },
        "producer": "uvm",
        "report_id": "INJECT_AMBIGUOUS",
        "scope_hint": {
          "basis": [
            "producer=uvm",
            "error_type=UVM_ERROR"
          ],
          "candidate": "environment_private",
          "final_routing": "undetermined",
          "producer": "uvm",
          "status": "non_authoritative"
        },
        "source_location": {
          "display": "/project/env/injection_check.sv(300)",
          "line": 300,
          "path": "/project/env/injection_check.sv"
        },
        "timestamp": "3ns"
      },
      "relative_log_path": "ambiguous_wave_31.log",
      "seed": 31,
      "seed_parse_status": "parsed",
      "simulation_time": {
        "normalized_fs": "3000000",
        "source": "max_observed_timestamp",
        "unit": "ns",
        "value": "3"
      },
      "statistics": {
        "ERROR": 0,
        "FAILED": 0,
        "FATAL": 0,
        "JVP TEST FAILED": 0,
        "SVA_ERROR": 0,
        "SVA_FATAL": 0,
        "SVA_WARNING": 0,
        "UVM_ERROR": 1,
        "UVM_FATAL": 0,
        "UVM_WARNING": 0,
        "VIRL_MEM_WARNING": 0
      },
      "status": "fail",
      "test_id": "ambiguous_wave",
      "top_errors": [
        {
          "description": "injected signal did not toggle",
          "description_template": "injected signal did not toggle",
          "description_template_status": "present",
          "error_id": "INJECT_AMBIGUOUS",
          "error_type": "UVM_ERROR",
          "event_time": {
            "normalized_fs": "3000000",
            "source": "reported_timestamp",
            "unit": "ns",
            "value": "3"
          },
          "level": "UVM_ERROR",
          "location": "/project/env/injection_check.sv(300)",
          "portable_signature": {
            "description_template": "injected signal did not toggle",
            "fingerprint": "sha256:c8519960ccd8538f3d2c0ad369a83a868c0486bec11d7755d4fb0ff54fadcefd",
            "strategy": "level_error_id_producer_description.v1"
          },
          "producer": "uvm",
          "report_id": "INJECT_AMBIGUOUS",
          "scope_hint": {
            "basis": [
              "producer=uvm",
              "error_type=UVM_ERROR"
            ],
            "candidate": "environment_private",
            "final_routing": "undetermined",
            "producer": "uvm",
            "status": "non_authoritative"
          },
          "source_location": {
            "display": "/project/env/injection_check.sv(300)",
            "line": 300,
            "path": "/project/env/injection_check.sv"
          },
          "timestamp": "3ns"
        }
      ],
      "working_directory": "/fixture/rtl_injection_minimal"
    },
    {
      "artifacts": {
        "case_directory": "/fixture/rtl_injection_minimal/private_complete",
        "resources": {
          "daidir": {
            "candidates": [
              {
                "exists": true,
                "expected_kind": "directory",
                "file_type": "directory",
                "path": "/fixture/rtl_injection_minimal/private_complete/simv.daidir",
                "priority": 0,
                "readable": true,
                "reason": null,
                "size_bytes": null,
                "source": "log_reference",
                "state": "available"
              },
              {
                "exists": false,
                "expected_kind": "directory",
                "file_type": "missing",
                "path": "/fixture/rtl_injection_minimal/simv.daidir",
                "priority": 11,
                "readable": false,
                "reason": "not_found",
                "size_bytes": null,
                "source": "configured_template",
                "state": "missing"
              }
            ],
            "reason": null,
            "selected": {
              "exists": true,
              "expected_kind": "directory",
              "file_type": "directory",
              "path": "/fixture/rtl_injection_minimal/private_complete/simv.daidir",